id, name, description, minfilestoformrelease, minsizetoformrelease
1	alt.binaries.0day.stuffz	This group contains mostly 0day software.	2	\N
2	alt.binaries.anime	This group contains mostly Anime Television.	5	268435456
3	alt.binaries.astronomy	This group contains mostly movies.	10	\N
4	alt.binaries.ath	This group contains a variety of Music. Some Foreign.	8	\N
5	alt.binaries.barbarella	This group contains a variety of German content.	\N	\N
6	alt.binaries.audio.warez	There is some old stuff in here, but this group is pretty much dead.	\N	\N
7	alt.binaries.b4e	This group contains 0day and has some foreign.	\N	\N
8	alt.binaries.big	This group contains XVid Movies. Mostly Foreign.	\N	\N
9	alt.binaries.bloaf	This group contains a variety. Mostly Foreign.	\N	\N
10	alt.binaries.blu-ray	This group contains blu-ray movies.	\N	\N
11	alt.binaries.boneless	This group contains XVid and X264 Movies. Some Foreign.	\N	\N
12	alt.binaries.british.drama	This group contains British TV shows.	10	\N
13	alt.binaries.cartoons.french	This group contains French cartoons.	\N	\N
14	alt.binaries.cats	This group contains mostly TV.	\N	\N
15	alt.binaries.cd.image.linux	This group contains Linux distributions.	\N	\N
16	alt.binaries.cd.image	This group contains PC-ISO.	4	\N
17	alt.binaries.cd.lossless	This group contains a variety of lossless Music.	\N	\N
18	alt.binaries.chello	This group contains mostly TV.	\N	\N
19	alt.binaries.classic.tv.shows	This group contains Classic TV and Movies.	\N	\N
20	alt.binaries.comics.dcp	This group contains Comic Books	\N	\N
21	alt.binaries.comp	This group contains Warez. Mostly Foreign.	\N	\N
22	alt.binaries.console.ps3	This group contains PS3 Games.	\N	\N
23	alt.binaries.cores	This group contains a variety including Nintendo DS. Lots of Foreign.	\N	\N
24	alt.binaries.country.mp3	This group contains Country Music.	5	\N
25	alt.binaries.dc	This group contains XVid and X264 Movies and TV. Mostly Foreign.	\N	\N
26	alt.binaries.dgma	This group contains XVid Movies. Mostly Foreign.	\N	\N
27	alt.binaries.divx.french	This group contains French XVid Movies.	\N	\N
28	alt.binaries.documentaries	This group contains Documentaries TV and Movies.	5	\N
29	alt.binaries.documentaries.french	This group contains French Documentaries TV and Movies.	5	\N
30	alt.binaries.downunder	This group contains mostly TV.	\N	\N
31	alt.binaries.dvd	This group contains DVD Movies.	\N	\N
32	alt.binaries.dvd.movies	This group contains DVDR Movies.	\N	\N
33	alt.binaries.dvdr	This group contains DVD Movies.	\N	\N
34	alt.binaries.dvd-r	This group contains DVD Movies.	\N	\N
35	alt.binaries.e-book.flood	This group contains E-Books.	\N	\N
36	alt.binaries.e-book.technical	This group contains E-Books.	\N	\N
37	alt.binaries.e-book	This group contains E-Books.	\N	\N
38	alt.binaries.ebook	This group contains Ebook's.	\N	\N
39	alt.binaries.erotica.divx	This group contains XXX.	\N	\N
40	alt.binaries.erotica	This group contains XXX.	10	\N
41	alt.binaries.etc	This group contains a variety of items.	10	\N
42	alt.binaries.font	This group contains mostly TV.	\N	\N
43	alt.binaries.french-tv	This group contains French TV.	\N	\N
44	alt.binaries.frogs	This group contains a variety.	\N	\N
45	alt.binaries.ftn	This group contains a variety of Music and TV.	\N	\N
46	alt.binaries.games.nintendods	This group contains Nintendo DS Games 	5	\N
47	alt.binaries.games	This group contains PC and Console Games.	5	\N
48	alt.binaries.games.wii	This group contains Nintendo WII Games, WII-Ware, and VC.	5	\N
49	alt.binaries.games.xbox360	This group contains XBOX 360 Games and DLC.	4	\N
50	alt.binaries.games.xbox	This group contains original XBOX Games.	5	\N
51	alt.binaries.ghosts	This group contains XVid TV and Movies. Mostly Foreign.	\N	\N
52	alt.binaries.hdtv	This group contains mostly HDTV 1080i rips.	5	\N
53	alt.binaries.hdtv.german	This group contains German HDTV.	\N	\N
54	alt.binaries.hdtv.x264	This group contains X264 Movies and HDTV.	5	\N
55	alt.binaries.highspeed	This group contains XVid Movies. Mostly Foreign.	\N	\N
56	alt.binaries.hou	This group contains a variety of content. Mostly Foreign.	\N	\N
57	alt.binaries.ijsklontje	This group contains XXX.	\N	\N
58	alt.binaries.inner-sanctum	This group contains PC and Music.	10	\N
59	alt.binaries.illuminaten	This group contains mostly German.	\N	\N
60	alt.binaries.ipod.videos	This group contains Mobile TV and Movies.	\N	\N
61	alt.binaries.linux.iso	This group contains Linux distributions.	5	100
62	alt.binaries.lou	This group contains mostly german TV.	\N	\N
63	alt.binaries.mac	This group contains MAC/OSX Software.	\N	\N
64	alt.binaries.mac.applications	This group contains MAC/OSX Software.	\N	\N
65	alt.binaries.milo	This group contains mostly TV, some german.	\N	\N
66	alt.binaries.misc	This group contains a variety of items.	\N	\N
67	alt.binaries.mojo	This group contains mostly TV.	\N	\N
68	alt.binaries.mma	This group contains MMA/TNA Sport TV.	\N	\N
69	alt.binaries.mom	This group contains a variety. Mostly Foreign.	\N	\N
70	alt.binaries.moovee	This group contains XVid and X264 Movies.	\N	\N
71	alt.binaries.movies.divx	This group contains XVid Movies	5	\N
72	alt.binaries.movies.erotica	This group contains XXX	\N	\N
73	alt.binaries.movies.french	This group contains French Movies.	\N	\N
74	alt.binaries.movies	This group contains an assortment of Movies.	10	\N
75	alt.binaries.movies.xvid	This group contains XVid Movies.	\N	\N
76	alt.binaries.mp3.audiobooks	This group contains Audio Books.	\N	\N
77	alt.binaries.mp3.bootlegs	This group contains Bootleg Music.	\N	\N
78	alt.binaries.mp3.full_albums	This group contains a variety of Music.	\N	\N
79	alt.binaries.mp3	This group contains a variety of Music.	11	\N
80	alt.binaries.mpeg.video.music	This group contains a variety of Music Videos.	\N	\N
81	alt.binaries.multimedia.anime.highspeed	This group contains Anime Television.	\N	\N
82	alt.binaries.multimedia.anime.repost	This group contains Anime Television.	\N	\N
83	alt.binaries.multimedia.anime	This group contains Anime TV and Movies.	\N	\N
84	alt.binaries.multimedia.cartoons	This group contains Cartoon TV and Movies.	\N	\N
85	alt.binaries.multimedia.classic-films	This group contains Classic TV and Movies.	\N	\N
86	alt.binaries.multimedia.comedy.british	This group contains British Comedy TV and Movies.	\N	\N
87	alt.binaries.multimedia.disney	This group contains Disney TV and Movies.	\N	\N
88	alt.binaries.multimedia.documentaries	This group contains Documentary Movies and TV.	\N	\N
89	alt.binaries.multimedia.erotica	This group contains XXX.	\N	\N
90	alt.binaries.multimedia.erotica.amateur	This group contains XXX.	\N	\N
91	alt.binaries.multimedia.scifi	This group contains science-fiction TV and movies.	\N	\N
92	alt.binaries.multimedia.scifi-and-fantasy	This group contains science-fiction and fantasy TV and movies.	\N	\N
93	alt.binaries.multimedia.sitcoms	This group contains Sitcom TV.	\N	\N
94	alt.binaries.multimedia.sports	This group contains Sports TV and Movies.	\N	\N
95	alt.binaries.multimedia	This group contains TV, Movies, and Music.	\N	\N
96	alt.binaries.multimedia.tv	This group contains XVid and X264 TV.	\N	\N
97	alt.binaries.multimedia.vintage-film	This group contains Vintage Movies pre 1960.	\N	\N
98	alt.binaries.multimedia.vintage-film.post-1960	This group contains Vintage Movies post 1960.	\N	\N
99	alt.binaries.music.flac	This group contains a variety of lossless Music.	\N	\N
100	alt.binaries.music.opera	This group contains Opera Music.	\N	\N
101	alt.binaries.nintendo.ds	This group contains Nintendo DS Games.	\N	\N
102	alt.binaries.nospam.cheerleaders	This group contains various.	\N	\N
103	alt.binaries.pictures.comics.complete	This group contains comics.	\N	\N
104	alt.binaries.pictures.comics.dcp	This group contains Comic Books.	\N	\N
105	alt.binaries.pictures.comics.reposts	This group contains Comic Books.	\N	\N
106	alt.binaries.pictures.comics.repost	This group contains Comic Books.	\N	\N
107	alt.binaries.pro-wrestling	This group contains WWE Sport TV.	\N	\N
108	alt.binaries.scary.exe.files	This group contains XVid and X264 Movies.	\N	\N
109	alt.binaries.series.tv.divx.french	This group contains French DIVX TV shows.	\N	\N
110	alt.binaries.sony.psp	This group contains PSP Games.	\N	\N
111	alt.binaries.sound.audiobooks	This group contains Audiobooks.	\N	\N
112	alt.binaries.sound.mp3	This group contains a variety of Music.	\N	\N
113	alt.binaries.sounds.1960s.mp3	This group contains Music from the 1960's.	\N	\N
114	alt.binaries.sounds.1970s.mp3	This group contains Music from the 1970's.	\N	\N
115	alt.binaries.sounds.audiobooks.repost	This group contains Audiobooks.	\N	\N
116	alt.binaries.sounds.country.mp3		5	\N
117	alt.binaries.sounds.flac	This group contains lossless music.	5	\N
118	alt.binaries.sounds.flac.jazz	This group contains lossless Jazz Music.	5	\N
119	alt.binaries.sounds.jpop	This group contains mostly Jpop music.	\N	\N
120	alt.binaries.sounds.lossless.1960s	This group contains lossless 1960's Music.	5	\N
121	alt.binaries.sounds.lossless.classical	This group contains lossless Classical Music.	5	\N
122	alt.binaries.sounds.lossless.country	This group contains lossless Country Music.	5	\N
123	alt.binaries.sounds.lossless	This group contains a variety of Lossless Music.	5	\N
124	alt.binaries.sounds.mp3.1950s	This group contains Music from the 1950's.	5	\N
125	alt.binaries.sounds.mp3.1970s	This group contains Music from the 1970's.	5	\N
126	alt.binaries.sounds.mp3.1980s	This group contains Music from the 1980's.	5	\N
127	alt.binaries.sounds.mp3.1990s	This group contains Music from the 1990's.	5	\N
128	alt.binaries.sounds.mp3.2000s	This group contains Music from the 2000's.	5	\N
129	alt.binaries.sounds.mp3.acoustic	This group contains Accoustic Music.	5	\N
130	alt.binaries.sounds.mp3.audiobooks	This group contains Audiobooks.	\N	\N
131	alt.binaries.sounds.mp3.bluegrass	This group contains Bluegrass Music.	5	\N
132	alt.binaries.sounds.mp3.christian	This group contains Christian Music.	5	\N
133	alt.binaries.sounds.mp3.classical	This group contains Classical Music.	5	\N
134	alt.binaries.sounds.mp3.comedy	This group contains Comedy Audio.	5	\N
135	alt.binaries.sounds.mp3.complete_cd	This group contains a variety of Music.	5	\N
136	alt.binaries.sounds.mp3.country	This group contains mostly country music.	\N	\N
137	alt.binaries.sounds.mp3.dance	This group contains Dance Music.	5	\N
138	alt.binaries.sounds.mp3.disco	This group contains Disco Music.	5	\N
139	alt.binaries.sounds.mp3.emo	This group contains Emo Music.	5	\N
140	alt.binaries.sounds.mp3.full_albums	This group contains a variety of Music.	5	\N
141	alt.binaries.sounds.mp3.heavy-metal	This group contains Heavy Metal Music.	5	\N
142	alt.binaries.sounds.mp3.jazz	This group contains Jazz Music.	5	\N
143	alt.binaries.sounds.mp3.jazz.vocals	This group contains Jazz Vocal Music.	5	\N
144	alt.binaries.sounds.mp3.musicals	This group contains Musicals Music.	5	\N
145	alt.binaries.sounds.mp3.nospam	This group contains a variety of Music.	5	\N
146	alt.binaries.sounds.mp3.opera	This group contains Opera Music.	5	\N
147	alt.binaries.sounds.mp3.progressive-country	This group contains Country Music.	5	\N
148	alt.binaries.sounds.mp3.rap-hiphop.full-albums	This group contains Rap and Hip-Hop Music.	5	\N
149	alt.binaries.sounds.mp3.rap-hiphop	This group contains Rap and Hip-Hop Music.	5	\N
150	alt.binaries.sounds.mp3.rock	This group contains Rock Music.	5	\N
151	alt.binaries.sounds.mp3	This group contains a variety of Music.	5	\N
152	alt.binaries.sounds.radio.bbc	This group contains BBC Radio Music	\N	\N
153	alt.binaries.sounds.radio.british	This group contains British Radio Music.	\N	\N
154	alt.binaries.sounds.whitburn.pop	This group contains Pop Music.	\N	\N
155	alt.binaries.tatu	This group contains mostly French TV.	\N	\N
156	alt.binaries.teevee	This group contains X264 and XVid TV.	10	\N
157	alt.binaries.test	This group contains a variety of content.	\N	\N
158	alt.binaries.town	This group contains XVid TV and Movies. Mostly Foreign.	\N	\N
159	alt.binaries.triballs	This group contains various.	2	\N
160	alt.binaries.tun	This group contains various.	\N	\N
161	alt.binaries.tvseries	This group contains X264 and XVid TV.	5	\N
162	alt.binaries.tv	This group contains XVid TV.	5	\N
163	alt.binaries.u-4all	This group contains XVid TV and Movies. Mostly Foreign.	\N	\N
164	alt.binaries.u4e	This group contains a variery, mostly German movies.	\N	\N
165	alt.binaries.ucc	This group contains mostly TV.	\N	\N
166	alt.binaries.ufg	This group contains mostly TV.	\N	\N
167	alt.binaries.uzenet	This group contains XXX. Some Foreign.	\N	\N
168	alt.binaries.warez.ibm-pc.0-day	This group contains PC-0Day.	\N	\N
169	alt.binaries.warez.quebec-hackers	This group contains PC-0day. Some Foreign.	\N	\N
170	alt.binaries.warez.smartphone	This group contains Mobile Phone Apps.	\N	\N
171	alt.binaries.warez	This group contains PC 0DAY, PC ISO, and PC PHONE.	5	1000000
172	alt.binaries.warez.uk.mp3	This group contains a variety of Music.	\N	\N
173	alt.binaries.wii	This group contains Nintendo WII Games, WII-Ware, and VC.	\N	\N
174	alt.binaries.wmvhd	This group contains WMVHD Movies.	\N	40000000
175	alt.binaries.worms	I have no idea what this group contains besides a lot of U4ALL which isn't really usable.	2	\N
176	alt.binaries.x264	This group contains X264 Movies and TV.	\N	\N
177	alt.binaries.x	This group contains a variety of content. Some Foreign.	\N	\N
178	alt.binaries.multimedia.erotica.anime	erotica anime	\N	\N
179	alt.binaries.multimedia.erotica.asian	erotica Asian	\N	\N
180	alt.binaries.mp3.audiobooks.scifi-fantasy	Audiobooks	\N	\N
181	alt.binaries.sounds.audiobooks.scifi-fantasy	Audiobooks	\N	\N
182	alt.binaries.mp3.abooks	Audiobooks	\N	\N
183	alt.binaries.town.xxx	XXX videos	\N	\N
184	alt.binaries.software	Software	\N	\N
185	alt.binaries.nzbpirates	Misc, mostly Erotica, and foreign movies 	\N	\N
186	alt.binaries.town.cine	Movies	\N	\N
187	alt.binaries.usenet-space-cowboys	Misc, mostly German	\N	\N
188	alt.binaries.warez.ibm-pc.games	misc, mostly games and applications	\N	\N
189	alt.binaries.warez.games	misc, mostly games and applications	\N	\N
190	alt.binaries.e-book.magazines	magazines, mostly english	\N	\N
191	alt.binaries.sounds.anime	music from Anime	\N	\N
192	alt.binaries.pictures.erotica.anime	Anime Manga, Adult	\N	\N
193	alt.binaries.drama.british		10	0
194	alt.binaries.emulators.misc		0	0
195	alt.binaries.erotica.classics		10	0
196	alt.binaries.old.games		0	0
197	alt.binaries.dvd.anime		3	0
198	alt.binaries.dvd.erotica.classics		15	\N
199	alt.binaries.gamecube	Added by import predb script	\N	\N
200	alt.binaries.games.nintendo3ds	Added by import predb script	\N	\N
201	alt.binaries.games.wiiu	Added by import predb script	\N	\N
202	alt.binaries.sony.psvita	Added by import predb script	\N	\N
203	alt.binaries.fz	This group contains german Movies and TV.	\N	\N
